key;title;year;month;day;journal;issn;volume;issue;pages;authors;url;language;publisher;location;abstract;notes;doi;keywords;pubmed_id;pmc_id;PDF files;[]
rayyan-146535457;Evolutionary benefits of personality traits when facing workplace bullying;2021;7;;PERSONALITY AND INDIVIDUAL DIFFERENCES;;177;;;Daderman, Anna M. and Basinska, Beata A.;;English;;;Facing workplace bullying negatively affects physical and mental health, and consequently quality of life and well-being. Personality traits that can help an individual survive and reproduce entail more benefits than costs. Building on two evolutionary theories, Life History Theory and Costly Signaling Theory, this study aims to provide novel insights into how and why personality traits are associated with facing workplace bullying and health-related quality of life. A heterogeneous group of 324 employees in Sweden provided data on workplace bullying, perceived health-related quality of life, and personality traits, controlling for sex and age. We found that openness (HEXACO model) and Machiavellianism (Dark Triad model) served as moderators. Employees with high values of these traits experienced significantly less affected health-related quality of life when facing workplace bullying. Our results indicate evolutionary origins of the personality traits openness and Machiavellianism. A new finding is that possessing, exhibiting, and maintaining traits reflecting a more creative and competitive interpersonal style increases an employee?s ability to survive aversive environments.;;10.1016/j.paid.2021.110849;;;;;
rayyan-146535458;Towards an Integrative Taxonomy of Social-Emotional Competences;2021;3;;FRONTIERS IN PSYCHOLOGY;;12;;;Schoon, Ingrid;;English;;;Social-emotional competences are critical for positive development and significantly predict educational and occupational attainment, health, and well-being. There is however a lack of consensus about the number of core competences, and how these are defined and operationalized. This divergence in approach challenges future research as well as the scientific usefulness of the construct. In an effort to create an integrative framework, this focused review evaluates different approaches of conceptualizing and assessing social-emotional competences. Building on shared conceptions, an integrative taxonomy ``DOMASEC{''} is introduced, specifying core domains and manifestations of social-emotional competences that bridge across frameworks focusing on social and emotional learning, personality traits (such as the Big Five) and self-determination theory. Core domains include intrapersonal, interpersonal and task-oriented competencies, differentiating between affective, cognitive, and behavioral manifestations of competences across these domains. It is argued that the integrative taxonomy facilitates the conceptual specification of key constructs, that it helps to better organize the multitude of terms and definitions used, and to guide the conceptualization and operationalization of social-emotional competences and their various facets.;;10.3389/fpsyg.2021.515313;;;;;
rayyan-146535459;How Multidimensional Is Emotional Intelligence? Bifactor Modeling of Global and Broad Emotional Abilities of the Geneva Emotional Competence Test;2021;3;;JOURNAL OF INTELLIGENCE;;9;1;;Simonet, V, Daniel and Miller, Katherine E. and Askew, Kevin L. and Sumner, Kenneth E. and Mortillaro, Marcello and Schlegel, Katja;;English;;;Drawing upon multidimensional theories of intelligence, the current paper evaluates if the Geneva Emotional Competence Test (GECo) fits within a higher-order intelligence space and if emotional intelligence (EI) branches predict distinct criteria related to adjustment and motivation. Using a combination of classical and S-1 bifactor models, we find that (a) a first-order oblique and bifactor model provide excellent and comparably fitting representation of an EI structure with self-regulatory skills operating independent of general ability, (b) residualized EI abilities uniquely predict criteria over general cognitive ability as referenced by fluid intelligence, and (c) emotion recognition and regulation incrementally predict grade point average (GPA) and affective engagement in opposing directions, after controlling for fluid general ability and the Big Five personality traits. Results are qualified by psychometric analyses suggesting only emotion regulation has enough determinacy and reliable variance beyond a general ability factor to be treated as a manifest score in analyses and interpretation. Findings call for renewed, albeit tempered, research on EI as a multidimensional intelligence and highlight the need for refined assessment of emotional perception, understanding, and management to allow focused analyses of different EI abilities.;;10.3390/jintelligence9010014;;;;;
rayyan-217341494;Explaining a Hybrid Competency-Meritocracy Model for Selection of Hospitals Executive Managers: A Scoping Review;2025;;;Medical Journal of the Islamic Republic of Iran;;39;1;;Dargahi, Hossein and Khonsari, Mohammad Hossein Ketabchi and Kooshkebaghi, Mahdi;https://www.scopus.com/inward/record.uri?eid=2-s2.0-85217102223&doi=10.47176%2fmjiri.39.6&partnerID=40&md5=562d08f551f79dd71acac92bb0b51471;;;;;Cited by: 0;;;;;;
rayyan-217341496;The importance of socio-emotional skills for multiple life outcomes and the role of education;2025;;;Handbook of Education and Work;;;;75 – 104;Belfi, Barbara and Borghans, Lex;https://www.scopus.com/inward/record.uri?eid=2-s2.0-105001743860&doi=10.4337%2f9781035309917.00010&partnerID=40&md5=09f40667be91b124b39ec1eb5b17b298;;;;;Cited by: 0;10.4337/9781035309917.00010;;;;;
rayyan-217341502;Adaptation and study of psychometric properties of the Socioemotional Competencies Scale (ECSE) in a sample of Colombian students between 12 and 18 years old;;;;;;;;;;;;;;;;;;;;;
rayyan-217341503;Teacher feedback and students’ self-concept, intrinsic value, and achievement in mathematics: Juxtaposing between- and within-person perspectives on long-term reciprocal relationships;2025;;;Contemporary Educational Psychology;;81;;;Hübner, Nicolas and Winstone, Naomi and Merk, Samuel and Hattie, John;https://www.scopus.com/inward/record.uri?eid=2-s2.0-105003096991&doi=10.1016%2fj.cedpsych.2025.102365&partnerID=40&md5=2866cccff248330b0533d001e962a46f;;;;;Cited by: 0;10.1016/j.cedpsych.2025.102365;;;;;
rayyan-217342280;Differences in change goals between personality traits and social, emotional, and behavioral skills;2025;7;;PERSONALITY AND INDIVIDUAL DIFFERENCES;;241;;;Feraco, Tommaso and Hudson, Nathan W. and Soto, Christopher J.;;English;;;Although research suggests that most people want to change their personality traits, previous studies have neither explored whether individuals also desire to change the social, emotional, and behavioral (SEB) skills linked to those traits, nor whether people have different beliefs about the malleability of skills vs. traits. In the present within-person experiment, 264 young adults from the US and Italy rated their desire to change each of the Big Five personality traits and the corresponding domains of SEB skills. They also rated their beliefs about the feasibility, motivation, and impact of making these changes. Results showed that participants reported similar or higher scores for skills, compared to traits, across all measured outcomes. Specifically, scores for social engagement and self-management skills were consistently higher than those for extraversion and conscientiousness. These findings indicate that people believe it to be more desirable-and more feasible-to change some SEB skills than the corresponding personality traits.;;10.1016/j.paid.2025.113200;;;;;
rayyan-217342281;Adolescents' social-emotional skills profiles, relationships at school, school anxiety, and educational aspirations;2025;6;;EUROPEAN JOURNAL OF PSYCHOLOGY OF EDUCATION;;40;2;;Huttunen, Ida and Upadyaya, Katja and Salmela-Aro, Katariina;;English;;;This study examined adolescents' social-emotional skills profiles before the educational transition to upper secondary education. Further, the study examined differences in gender;;;;;;;
rayyan-217342282;Academic agency and educational attainment: The intersection of SES, ethnicity and sex;2025;5;;LEARNING AND INDIVIDUAL DIFFERENCES;;120;;;Schoon, Ingrid and Mele, Francesca and Burger, Kaspar;;English;;;Drawing on the nationally representative Longitudinal Study of Young People in England (LSYPE;;;;;;;
rayyan-217342283;Hurry up and wait: Developmental anxiety during the transition to adulthood;2025;;;JOURNAL OF FAMILY THEORY \& REVIEW;;;;;Ratner, Kaylin and Budesheim, Erin F. and Alexander, Chelsea S. and Klein, Robert C. and Leinenweber, Simone and Zhang, Lei and Zhao, Talia Yue and Garcia Romero, Oswaldo and Napolitano, Christopher M.;;English;;;Growing up is rarely easy, yet adolescents and young adults today are reporting distress at rates never seen before. We propose this trend can be traced to societal forces that accelerate and suppress development, resulting in developmental anxiety (i.e., worry about meeting adult milestones on time, if ever). Drawing on foundational theories from developmental and family sciences, we introduce hurries and waits as umbrella terms for these simultaneous and contradictory forces and explain how developmental anxiety may arise from the tension they place on young people. We next identify strengths that both young people and their families can use to navigate hurry-wait tension, and close with an agenda for future research. This updated, systems-based lens on the transition to adulthood prepares the field to help young people achieve the fulfilling adult life that previous generations looked forward to with greater promise.;;10.1111/jftr.12621;;;;;
rayyan-217342284;Association between urbanization levels and frailty among middle-aged and older adults in China: evidence from the CHARLS;2025;3;;BMC MEDICINE;;23;1;;Xie, Xinlan and Que, Jiaqun and Sun, Linsu and Sun, Tao and Yang, Feng;;English;;;Background Rapid urbanization is underway in China. However, the impact of urbanization on frailty remains unclear. This study aims to investigate the relationship between urbanization and frailty among middle-aged and older adults. Methods We analyzed nationally representative data from the China Health and Retirement Longitudinal Study (CHARLS) spanning 2011 to 2018. After applying inclusion and exclusion criteria, 10,758 non-frail individuals at baseline were analyzed. The exposure of interest was the comprehensive urbanization level. Urbanization level (0.072-0.689) was assessed using the entropy method. Frailty was assessed using the frailty index (FI), which ranges from 0 to 100. Frailty was defined as FI >= 25, and the urbanization-frailty association was assessed using - the restricted cubic spline (RCS) expressions and Cox proportional hazards models. Least absolute shrinkage and selection operator (LASSO) regression were employed to evaluate major factors associated with frailty. Results The results revealed a U-shaped nonlinear association between urbanization level and frailty incidence, with a turning point at 0.3 (P-nonlinear < 0.001). In the Cox model, for urbanization scores below 0.3, each ten-percentile increase was associated with an HR of 0.871 (95\% CI 0.843-0.900, P < 0.05). Conversely, scores at or above 0.3 had an HR of 1.178 (95\% CI 1.053-1.319, P < 0.05) per ten-percentile increase. In the subgroup analysis of participants with urbanization scores below 0.3, there was a significant interaction between current work status and subgroups with dyslipidemia. LASSO regression showed that, for urbanization scores < 0.3, total retail sales (coefficient = - 0.129) and per capita income (coefficient = - 0.071) were most protective against frailty. For scores >= 0.3, key urbanization factors associated with increased frailty risk included the number of college students per 10,000 people (coefficient = 0.080) and the proportion of built-up land in the urban area (coefficient = 0.060). Conclusions Urbanization level had U-shaped association with frailty incidence. Factors such as total retail sales of consumer goods per capita, per capita disposable income of urban residents, and the number of college students per 10,000 people may be key in formulating a strategy for frailty prevention.;;10.1186/s12916-025-03961-y;;;;;
rayyan-217342285;Role of leaders' positive mindset in mitigating the effects of crises on organizations: The case of Canadian organizations;2025;3;;PLOS ONE;;20;3;;Ouakouak, Mohammed Laid and Ouedraogo, Noufou and Hewapathirana, Gertrude I. and Zaitouni, Michel;;English;;;Maintaining a positive mindset is important for leadership effectiveness and may even be more important in times of a crisis because such a mindset contributes to organizational survival and resilience. In this study, we examined whether leaders' positive mindset helped to mitigate the harmful effects of the COVID-19 crisis on organizations and if so, how. To address this issue, we conducted an empirical study through LinkedIn with 165 participants working in various organizations in Canada. The results show that leaders' positive mindset positively impacts leaders' innovative behavior. However, leaders' innovative behavior did not attenuate the negative effects of the COVID-19 crisis on organizations, except when we introduce the use of information and communication technology (ICT) and the provision of psychological support to employees as moderators. The implications of these findings for both theory and practice, as well as some future research directions are discussed.;;10.1371/journal.pone.0319931;;;;;
rayyan-217342286;Changes in social, emotional, and behavioral skills are associated with changes in secondary school students' important outcomes;2025;;;EUROPEAN JOURNAL OF PERSONALITY;;;;;Napolitano, Christopher M. and Soto, Christopher J. and Sewell, Madison N. and Yoon, Hee Jun and Roberts, Brent W.;;English;;;Evidence across the social sciences suggests the importance of social, emotional, and behavioral (SEB) skills for a wide variety of youth outcomes. However, most of this work is cross-sectional. We know little about how patterns of change in adolescents' SEB skills may be related to commensurate patterns of change in important outcomes across an academic year. Drawing from a sample of American secondary school students (N = 942), this longitudinal study employs latent change score models to fill that gap. We report four key findings. We find that (1) a short version of the Behavioral, Emotional, and Social Skills Inventory (BESSI) is psychometrically suitable for longitudinal analyses. We further find that (2) SEB skills are highly stable, on average, but also (3) characterized by significant between-person variation in change. Centrally, we find that (4) positive changes in SEB skills are related to changes in academic engagement, friendship quality, anxiety, depression, life satisfaction, as well as other measures of social and emotional competencies. Taken together, the results suggest that SEB skills are malleable, but future work is needed to identify patterns of change and develop and test targeted interventions.;;10.1177/08902070251328046;;;;;
rayyan-217342287;Challenges and Opportunities for the Assessment of Social-Emotional Skills;2025;;;ECNU REVIEW OF EDUCATION;;;;;De Fruyt, Filip and Scheirlinckx, Joyce;;English;;;Purpose This review paper addresses three major challenges hindering progress in the field of social-emotional learning in education.Design/Approach/Methods We first discuss how social-emotional skills could be conceptualized, contrasting identity versus self-efficacy approaches. Second, we argue to develop more objective assessments of social-emotional skills and their development, as a supplement of currently and frequently used self- and informant descriptions relying on Likert-based scales. Third and finally, we discuss recurrent issues that are raised when debating the implementation of social-emotional skill learning in the classroom.Findings The review suggests that, at this point in time, both self-efficacy and identity conceptualizations of social-emotional skills are valuable approaches. Future research will need to explore which conceptualization for which skills demonstrates the best predictive validity, taking into account the nature of outcomes and contexts. The desired characteristics of more objective social-emotional skill measures are defined, and we encourage to examine how these overlap with self-reports using construct maps. Finally, we underscore the importance of having a comprehensive and evidence-informed taxonomy of social-emotional skills to guide the debate on the inclusion of social-emotional skill learning in curricula and its implementation in the classroom.Originality/Value This short review is primarily written for practitioners and policymakers to give a quick and accessible update on the key challenges in social-emotional learning today. The review should trigger more in-depth reading on the topic, but also support readers to understand current problems and help them dealing with questions and potential objections that might be raised by different stakeholders.;;10.1177/20965311251319355;;;;;
rayyan-217342288;The mental health and social emotional skills of students with different learning difficulties in China;2025;;;ANNALS OF DYSLEXIA;;;;;Wang, Ling-ling and Huang, Dan-xin and Cai, Dan and Georgiou, George K.;;English;;;This study aimed to examine the mental health and social-emotional skills of individuals with mathematics difficulties (MD), reading difficulties (RD), and comorbid difficulties (MDRD) in China. Students with MD (n = 35), RD (n = 27), MDRD (n = 43), and typically-developing peers (TD, n = 167) completed the Children's Depression Inventory, the Children's Loneliness Questionnaire, the Social Anxiety Questionnaire, and the Survey on Social Emotional Skills (SSES). In regard to mental health, results showed that MDRD experienced significantly higher levels of loneliness compared to TD, while MD had significantly higher levels of depression than TD. No significant differences were found in mental health outcomes between the MD, RD, and MDRD groups. In regard to social-emotional skills, the results showed that MD had significantly lower levels of persistence, responsibility, self-control, emotional control, curiosity, and energy compared to TD. MDRD also showed significantly lower curiosity compared to TD. There were no significant differences in task performance, emotional regulation, collaboration, and open-mindedness among the MD, RD, and MDRD groups. These findings suggest that different learning difficulties are associated with distinct profiles of mental health and social-emotional skills.;;10.1007/s11881-025-00325-2;;;;;
rayyan-217342289;Ready for What's Next? The Associations Between Social, Emotional, and Behavioral Skills and Career Adaptability in High School Students;2025;;;JOURNAL OF ADOLESCENCE;;;;;Pellegrino, Gerardo and Feraco, Tommaso and Meneghetti, Chiara and Carretti, Barbara;;English;;;Introduction: Transitioning from school to higher education or work is a pivotal moment in a student's life, requiring life-changing decisions. During this period, students who have acquired a wide range of Social, Emotional, and Behavioral (SEB) skills may feel more confident regarding their capacity to adapt positively to future challenges and difficulties. Our study aimed to test whether five SEB skills domains (self-management, innovation, social engagement, cooperation, and emotional resilience skills) were associated with four career adaptability resources (i.e., concern, control, curiosity, and confidence). Methods: A cross-sectional study was conducted on 350 Italian students (143 boys;;;;;;;
rayyan-217342290;A fine-grained human facial key feature extraction and fusion method for emotion recognition;2025;2;;SCIENTIFIC REPORTS;;15;1;;Li, Shiwei and Wang, Jisen and Tian, Linbo and Wang, Jianqiang and Huang, Yan;;English;;;Emotion, a fundamental mapping of human responses to external stimuli, has been extensively studied in human-computer interaction, particularly in areas such as intelligent cockpits and systems. However, accurately recognizing emotions from facial expressions remains a significant challenge due to lighting conditions, posture, and micro-expressions. Emotion recognition using global or local facial features is a key research direction. However, relying solely on global or local features often results in models that exhibit uneven attention across facial features, neglecting key variations critical for detecting emotional changes. This paper proposes a method for modeling and extracting key facial features by integrating global and local facial data. First, we construct a comprehensive image preprocessing model that includes super-resolution processing, lighting and shading processing, and texture enhancement. This preprocessing step significantly enriches the expression of image features. Second, A global facial feature recognition model is developed using an encoder-decoder architecture, which effectively eliminates environmental noise and generates a comprehensive global feature dataset for facial analysis. Simultaneously, the Haar cascade classifier is employed to extract refined features from key facial regions, including the eyes, mouth, and overall face, resulting in a corresponding local feature dataset. Finally, a two-branch convolutional neural network is designed to integrate both global and local facial feature datasets, enhancing the model's ability to recognize facial characteristics accurately. The global feature branch fully characterizes the global features of the face, while the local feature branch focuses on the local features. An adaptive fusion module integrates the global and local features, enhancing the model's ability to differentiate subtle emotional changes. To evaluate the accuracy and robustness of the model, we train and test it on the FER-2013 and JAFFE emotion datasets, achieving average accuracies of 80.59\% and 97.61\%, respectively. Compared to existing state-of-the-art models, our refined face feature extraction and fusion model demonstrates superior performance in emotion recognition. Additionally, the comparative analysis shows that emotional features across different faces show similarities. Building on psychological research, we categorize the dataset into three emotion classes: positive, neutral, and negative. The accuracy of emotion recognition is significantly improved under the new classification criteria. Additionally, the self-built dataset is used to validate further that this classification approach has important implications for practical applications.;;10.1038/s41598-025-90440-2;;;;;
rayyan-217342291;Digitally assessing social-emotional skills in early school years: initial validation of a screening instrument;2025;2;;FRONTIERS IN PSYCHOLOGY;;16;;;Kogler, Andrea and Gasteiger-Klicpera, Barbara and Prinz, Katharina and Paleczek, Lisa;;English;;;Introduction Social-emotional skills are essential in everyday interaction and develop in early and middle childhood. However, there is no German instrument to help primary school students identify their strengths and weaknesses in different social-emotional skills that does not rely on written language. This paper introduces a new digital instrument, the GraSEF: Grazer Screening to assess Social-Emotional Skills, which was developed to measure (1) Behavior in Social Situations, (2) Prosocial Behavior, (3) Emotion Regulation Strategies, (4) Emotion Recognition and (5) Self-Perception of Emotions using different test formats (e.g., situational judgement test, self-assessment, performance tests). In the GraSEF, students work through an online survey tool, using audio instructions to guide them through the test.Methods The present study analyses the responses of second graders (Mage = 8.23 years, SDage = 0.48, 48\% female). The intention was to gain initial insight into the instrument's psychometric quality and user-friendliness.Results In general, the instrument was found to have acceptable to good internal consistency, sufficient discriminatory power and item difficulty. However, one subtest (5: Self-Perception of Emotions), as well as three situations of the situational judgment test (1: Behavior in Social Situations), were excluded due to unsatisfactory fit and distribution. The validity check revealed low to moderate correlations between teacher rating and student scores. On average, students completed the screening in about 30 min and provided positive feedback regarding usability.Discussion While the small sample size only provides preliminary insight into the instrument's psychometric quality, the results suggest that the GraSEF can reliably measure various dimensions of social-emotional skills in second graders, even among those with low reading skills.;;10.3389/fpsyg.2025.1529083;;;;;
rayyan-217342293;The role of social, emotional, and behavioral skills for nature connectedness, action competence, and proenvironmental behaviors in adolescence;2025;;;ENVIRONMENTAL EDUCATION RESEARCH;;;;;Feraco, Tommaso and Carbone, Elena and Cramarossa, Giulia and Meneghetti, Chiara;;English;;;Following indications from international organizations, this study tests the associations between the five domains of social, emotional, and behavioral (SEB) skills (self-management, innovation, social engagement, cooperation, and emotional resilience) and two key antecedents of proenvironmental behavior, namely nature connectedness and self-perceived action competence for sustainability, in a sample of 702 students aged between 12 and 20 years (M = 16.18, SD = 2.15;;;;;;;
