key;title;year;month;day;journal;issn;volume;issue;pages;authors;url;language;publisher;location;abstract;notes;doi;keywords;pubmed_id;pmc_id;PDF files;[]
rayyan-146535367;Do early school- and family-related factors predict midlife psychological well-being? Findings from A prospective Black childhood cohort study;2024;11;;CHILDREN AND YOUTH SERVICES REVIEW;;166;;;Morency, Mirinda M. and Reynolds, Arthur J.;;English;;;The relationship between early school- and family-related factors and later psychological well-being (PWB) has been insufficiently studied. To address this gap, a comprehensive model was employed to investigate the effects of school and family predictors (ages < 14) on PWB, and a related construct, life satisfaction (LS), at age 35 for a large urban childhood cohort. 30-year follow-up data were analyzed for 72 \% (N = 1,112) of the original 1,539 participants (93 \% Black) in the Chicago Longitudinal Study, a prospective investigation on the impact of an early childhood education program. Hierarchical linear regression analysis revealed both parent (beta = 0.51p = 0.013) and student educational attainment expectations (beta = 1.48;;;;;;;
rayyan-146535368;Developing the Short Form of the Survey on Social and Emotional Skills (SSES-SF);2024;;;JOURNAL OF PERSONALITY ASSESSMENT;;;;;Wang, Faming and King, Ronnel B.;;English;;;Given the critical role of socio-emotional skills in students' academic success, psychological well-being, and other critical life outcomes, the Organization for Economic Cooperation and Development (OECD) developed the Survey on Social and Emotional Skills (SSES) to measure these skills among school-age students. However, the broad conceptual scope of socio-emotional skills necessitated the use of a large number of items (i.e., 120 items) in the original SSES, which poses challenges regarding survey administration and participant fatigue. To address these issues, this study aimed to develop a short form of the SSES (i.e., SSES-SF). The sample included 29,798 15-year-old students across 10 regions. We developed a 45-item version of SSES-SF using the machine learning approach of genetic algorithm, which is 62.5\% shorter than the original 120-item SSES. The reliability, construct validity, reproduced information, concurrent validity, and measurement invariance of the SSES-SF were investigated. We found that the SSES-SF demonstrated satisfactory reliability, construct validity, and concurrent validity. Furthermore, the SSES-SF was able to reproduce a substantial amount of information from the original full-form SSES and exhibited measurement invariance across genders, regions, and language groups. Theoretical and practical implications of the findings are discussed.;"RAYYAN-INCLUSION: {""Tommaso""=>""Maybe""}";10.1080/00223891.2024.2416416;;;;;
rayyan-146535369;The Zero-Sum Mindset;2024;10;;JOURNAL OF PERSONALITY AND SOCIAL PSYCHOLOGY;;127;4;758-795;Fearon, Patricia Andrews and Gotz, Friedrich M.;;English;;;Seeing a situation as a zero-sum game, where one party's success must come at the expense of another, stifles cooperation-even when such cooperation could greatly benefit both parties. Consequently, zero-sum beliefs can undermine progress when cooperation is needed for success. In this article, we propose that zero-sum thinking (any specific instance of zero-sum construals or beliefs) can also be understood as a broader mindset-a generalized belief about how the world works. Thus, the zero-sum mindset predisposes one toward zero-sum thinking, and its cognitive and strategic consequences, across situations and domains. In an investigation spanning six countries (Belgium, India, Italy, Pakistan, the United Kingdom, and United States) on three continents, and more than 10,000 unique participants, we use cross-sectional, longitudinal, and experimental methods to provide foundational evidence for the zero-sum mindset. In Studies 1-5 (Concept), we show that the zero-sum mindset is distinct from existing concepts, stable over time, and predictive of disparate instances of zero-sum thinking and its strategic implications across domains and cultures. In Studies 6-7 (Cognitions), we show that zero-sum configurations of success promote hostile interpretations of others and that the zero-sum mindset predicts this bias even in objectively non-zero-sum situations. In Studies 8-9 (Consequences), we show that the zero-sum mindset predicts lower cooperation even in situations where cooperation is a matter of life or death. These findings call attention to the way lay game theories such as the zero-sum mindset bear critical implications for the cognitions and attitudes that drive social behavior and success.;"RAYYAN-INCLUSION: {""Tommaso""=>""Maybe""}";10.1037/pspa0000404;;;;;
rayyan-146535370;Comparing the Impact of Non-Cognitive Skills in STEM and Non-STEM Contexts in Kazakh Secondary Education;2024;10;;EDUCATION SCIENCES;;14;10;;Sultanova, Gulbakhyt and Shora, Nurym;;English;;;The role of non-cognitive skills in academic achievement has garnered increasing attention in educational research. This study explores the impact of non-cognitive skills on academic achievement in STEM and non-STEM subjects in secondary education. Survey data from 795 teachers and 12,965 students across 20 STEM schools in Kazakhstan were analyzed to examine the impact of 26 non-cognitive skills on performance in math, physics, first language, and history. Regression and mediation analyses were conducted to investigate how students' self-assessment of non-cognitive skills directly affects academic achievement and how these effects are mediated by teachers' assessments. The findings indicate that non-cognitive skills exhibit varying direct and total effects, with mediated effects showing greater consistency across different subjects. In math and physics, information processing skill and grit show the strongest direct and total effects on academic achievement. In first language and history, responsibility management and teamwork skill are most influential. Except for capacity for optimism and growth mindset, all skills demonstrated mediated effects across the four subjects. This research informs curriculum development and equitable policies by showing how non-cognitive skills impact academic performance across subjects. It studies the case of Kazakhstan, adding to global education discourse and offering valuable insights for enhancing STEM education.;"RAYYAN-INCLUSION: {""Tommaso""=>""Included""}";10.3390/educsci14101109;;;;;
rayyan-146535371;Predicting undergraduate OSCE performance using traditional and construct-driven situational judgment tests at admission;2024;;;ADVANCES IN HEALTH SCIENCES EDUCATION;;;;;Mielke, Ina and Breil, Simon M. and Hissbach, Johanna and Ehrhardt, Maren and Knorr, Mirjana;;English;;;Situational Judgement Tests (SJTs) are popular to screen for social skills during undergraduate medical admission as they have been shown to predict relevant study outcomes. Two different types of SJTs can be distinguished: Traditional SJTs, which measure general effective behavior, and construct-driven SJTs which are designed to measure specific constructs. To date, there has been no comparison of the predictive validity of these two types of SJTs in medical admission. With the present research, we examine whether the HAM-SJT, a traditional SJT, and the CD-SJT, a construct-driven SJT with an agentic and a communal scale, administered during undergraduate medical admission can predict OSCE (i.e., objective structured clinical examination) performance in a low-stakes (nLS = 159) and a high-stakes (nHS = 160) sample of medical students. Results showed a moderate positive relation between the communal scale of the CD-SJT and performance in OSCE stations with trained patients in the high-stakes sample (r =.20, p =.009). This SJT had also an incremental value in predicting the OSCE performance above and beyond GPA (i.e., grade point average), a science test (i.e., HAM-Nat), and gender (ss = 0.18, 95\% CI {[}0.03;;;;;;;
rayyan-146535372;Sense of purpose and social-emotional-behavioral skills during university;2025;2;;PERSONALITY AND INDIVIDUAL DIFFERENCES;;233;;;Beatty, Jennifer F. and Hill, Patrick L. and Spengler, Marion;;English;;;Past research has demonstrated that university students with a stronger sense of purpose tend to fare better than their peers. However, work is needed to investigate the mechanisms and skills that may underlie these associations. The current studies employed two university student samples (total n = 412) and comprehensively investigated associations between sense of purpose and social-emotional-behavioral skills, using multiple purpose measures. Associations were relatively similar across measures and samples, and results suggested that sense of purpose was most robustly positively associated with self-management skills. Sense of purpose also was associated with better student wellbeing (life satisfaction, college satisfaction, and student connectedness), though it was inconsistently associated with reported likelihood of degree completion. Sense of purpose largely remained a significant correlate of student wellbeing, even when accounting for SEB skill domains, although some associations between purpose and wellbeing were reduced in magnitude.;"RAYYAN-INCLUSION: {""Tommaso""=>""Included""}";10.1016/j.paid.2024.112870;;;;;
rayyan-146535373;Associations between a multifaceted personality and academic performance in secondary school;2024;;;EUROPEAN JOURNAL OF PERSONALITY;;;;;Brandt, Naemi D. and Spengler, Marion and Lechner, Clemens M. and Goellner, Richard and Wagner, Jenny;;English;;;Whereas meta-analytic evidence has accumulated about the important role personality characteristics such as the Big Five traits play for academic performance in secondary school, less is known about the specific behavioral and emotional repertoire that drives these associations. A closer look at the facet-level of Big Five traits can provide this knowledge helping to better understand why students differ in their success at school. We therefore studied associations between Big Five facets and academic performance (grades and standardized test scores in German and mathematics) in three independent secondary student samples (Study 1 N = 3866, Study 2 N = 2290, and Study 3 N = 366), using regression analytic, structural equation modeling, and meta-analytic procedures to test facet-level associations and incremental associations above traits. We found facet-differential associations with academic performance indicators, particularly for facets of conscientiousness, openness, and extraversion. Evidence for incremental effects of facets beyond traits was weak. Self-discipline (conscientiousness) was the only facet that consistently showed incremental effects across Samples 1 and 2. The results can stimulate research and practice to identify the underlying mechanisms that drive these associations and also highlight the specific emotional and behavioral repertoire that should be supported to help students to succeed in school. People differ in the way they act, think, and feel-their personality traits-and these trait differences have been shown to be predictive for how well students perform in school. Besides findings on the broader trait level, less is known about which specific behavioral and emotional repertoire might drive these associations. A closer look at the narrower facet-level can provide this knowledge helping to better understand why students differ in their success at school. We therefore studied associations between personality facets and academic performance (grades and standardized test scores in German and mathematics) in three independent secondary student samples (Study 1 N = 3866, Study 2 N = 2290, and Study 3 N = 366) and integrated these findings later on. Particularly, we wanted to know whether facets can explain differences in academic performance above what is explained by broader traits. We found evidence for facet-specific associations with grades and test scores;;;;;;;
rayyan-146535374;The impact of adolescents' voice through an online school radio: a socio-emotional learning experimental project;2024;9;;FRONTIERS IN PSYCHOLOGY;;14;;;Sarmento, Patricia and Lobo, Mafalda and Kirtikumar, Kalpna;;English;;;Universal school-based socio-emotional learning (SEL) programs for adolescents have shown their efficacy in producing positive outcomes. The aim of the current study is to present an original school-based program and project for adolescents-Semear Valores On-air - and to assess the relationship between participation in the project and students' socio-emotional skills. Based on the character strengths and virtues model, this online school radio project aimed at promoting communication, creative thinking, adaptability, and resilience skills in adolescents and giving them the opportunity to become influential agents of well-being and citizenship. As part of the school curriculum, students were invited to create and record radio shows and podcasts. An online school radio was thus created, and it continues to broadcast all over the world, with music, daily shows, and interviews 24/7. It was developed within the framework of the Gulbenkian Academies for Knowledge, a nationwide Portuguese program, that seeks to prepare children and youth for change, to enable them to deal with complex problems, and to expand their opportunities for achievement. A quasi-experimental design, with a mixed qualitative-quantitative approach was used to analyze data collected from 112 adolescents in the second year of its implementation, in 2020-2021. Results suggest that (1) teachers' perceptions of student's socio-emotional skills in the post test showed more positive associations with the participation in the project, than participant's perceptions;;;;;;;
rayyan-146535375;Longitudinal associations between adolescents' social-emotional skills, school engagement, and school burnout☆;2024;10;;LEARNING AND INDIVIDUAL DIFFERENCES;;115;;;Huttunen, Ida and Upadyaya, Katja and Salmela-Aro, Katariina;;English;;;This longitudinal study investigated to what extent five key social-emotional skills persistence, academic buoyancy, curiosity, social engagement, and lack of loneliness were associated with adolescents' school engagement and burnout at two timepoints. Furthermore, the role of gender and socioeconomic status were examined. The data were collected from 1021 adolescents (ages 12-14) in the fall of 2021 and 2022. The results were analyzed using structural equation modeling (SEM) and revealed that, in general, social-emotional skills were associated with higher school engagement and lower burnout among adolescents. Curiosity showed a strong relationship with school engagement. Moreover, persistence was associated with an increase in school engagement among adolescents with low-average socioeconomic status. High academic buoyancy and lack of loneliness were associated with decrease in burnout over the school years. The study implies that recognizing the variety of adolescent's social-emotional skills may help to better support adolescents' school engagement and protect them from burnout. Educational relevance and implications statement: According to the study findings, social-emotional skills, such as persistence and curiosity, were associated with higher school motivation and lower burnout of adolescents. These results suggest that interventions aiming to develop adolescents' social-emotional skills may promote adolescents' motivation. Supporting adolescents' social relationships in school may also protect adolescents from burning out. To better support adolescent students' motivation and well-being at school it is important to recognize the diversity of individual adolescents' needs and strengths in social-emotional skills. Therefore, sufficient education and training would be needed for teachers concerning the variety of social-emotional skills.;;10.1016/j.lindif.2024.102537;;;;;
rayyan-146535376;Do social engagement skills exist and matter beyond personality facet traits and vocational interests? A generalization study across six countries☆;2024;10;;LEARNING AND INDIVIDUAL DIFFERENCES;;115;;;Roemer, Lena and Rammstedt, Beatrice and Lechner, Clemens M.;;English;;;Social engagement skills as capacities for active interpersonal engagement are thought to conceptually differ from behavioral and motivational tendencies and to predict learning and life outcomes. We tested these assumptions on the distinct nature and relevance of social engagement skills. Quota-representative self-reports from 6987 adults in six countries showed strong relations of social engagement skills with personality facets and weaker with vocational interests. Partially supporting their distinctiveness, social engagement skills were not fully reducible to those correlates. Skills predicted self-reported learning, quality-of-life, and job outcomes, but offered little incremental validity beyond personality and interests. Results largely generalized across countries. Yet, the complex interplay between social engagement skills, individual differences, and outcomes demonstrated crosscountry variations, suggesting sensitivity to sociocontextual factors. We conclude that while social engagement skills conceptually differ from personality and interests and in themselves predict life success, they add limited empirical value beyond these constructs, at least for self-reports. Educational relevance statement: Social engagement skills are the capacities to actively engage with others. It is thought that these capacities differ from other person characteristics (e.g., behavioral or motivational tendencies), and that this distinction matters for explaining life success. Our study showed that while self-reported social engagement skills shared similarities with other person characteristics, they still had unique aspects. Moreover, social engagement skills mattered, such that more skilled adults reported higher quality-of-life, but not necessarily better learning. However, social engagement skills did not provide much extra insight into life success beyond what was already known from other person characteristics. Other than the remaining results, these complex relations between social engagement skills, person characteristics, and life success largely varied across countries. The results highlight the importance of assessing social skills in a situation-specific manner, which will be imperative for targeted educational practices in the future. Moreover, our study focused on adults, limiting applicability to youth, but results suggest that intervention efforts targeting social engagement skills may probably yield more interpersonal than academic benefits. Finally, when designing or adapting complex educational programs, practitioners should consider sociocontextual factors.;;10.1016/j.lindif.2024.102522;;;;;
rayyan-146535377;Social, Emotional, and Behavioral (SEB) Skills in the Workplace;2024;7;;COLLABRA-PSYCHOLOGY;;10;1;;Chen, Lilang and Zhang, Bo and Li, Jian;;English;;;The current study sought to extend Soto et al. (2022)'s results on social, emotional, and behavioral (SEB) skills to a work setting and answer three key questions. First, do SEB skills predict consequential work-related outcomes? Second, do SEB skills provide incremental validity over the Big Five personality traits in predicting the outcomes? Third, is the joint effect of SEB skills and traits additive or multiplicative? Results from a sample of real estate agents (N N = 2,992) in China extend the criterion space of SEB skills by showing self-concepts of these skills are related to self-reported work outcomes such as citizenship behaviors and job satisfaction in a conceptually meaningful way. Further analyses show that these skill-outcome relationships remain robust after accounting for effects of traits, indicating SEB skills' incremental validity beyond traits in predicting outcomes. Finally, comparisons between additive and multiplicative models show support for the former because the interaction effects of SEB skills and traits provide little meaningful information beyond the additive models. Based on these findings, we discuss the implications for the SEB skills literature and practice.;;10.1525/collabra.120531;;;;;
rayyan-146535378;Assessing Social, Emotional, and Behavioral Skills in Just a Few Minutes: 96-, 45-, and 20-Item Short Forms of the BESSI;2024;;;ASSESSMENT;;;;;Sewell, Madison N. and Yoon, Hee J. and Lechner, Clemens M. and Napolitano, Christopher M. and Rammstedt, Beatrice and Roberts, Brent W. and Soto, Christopher J.;;English;;;Social, emotional, and behavioral (SEB) skills matter for individuals' well-being and success. The behavioral, emotional, and social skills inventory (BESSI) uses 192 items to assess 32 specific SEB skills across five broad skill domains. This research developed three short forms of the BESSI-192 and explored their measurement properties, predictive validity, and cross-cultural comparability. We found that BESSI-96, BESSI-45, and BESSI-20 largely captured the psychological content of the BESSI-192 measure, retained a robust multidimensional structure, and demonstrated adequate reliability. At the domain and facet level, the BESSI short forms showed patterns of associations with external criteria that were similar to the BESSI-192 and preserved most of the BESSI-192's predictive power. The BESSI short forms also demonstrated full or partial measurement invariance between the primarily U.S.-based and German adult samples. We conclude by discussing contexts in which the short forms may be useful for researchers and practitioners.;;10.1177/10731911241256434;;;;;
rayyan-146535379;The Relation Between Soft Skills and Arithmetic Performance;2024;;;JOURNAL OF EXPERIMENTAL EDUCATION;;;;;Feraco, Tommaso and Mammarella, Irene C. and Meneghetti, Chiara;;English;;;Arithmetic achievement holds particular significance in contemporary times;;;;;;;
rayyan-146535380;Nursing students' personality (Temperament and Character), burnout symptoms, and health and well-being;2024;6;;INTERNATIONAL JOURNAL OF NURSING STUDIES ADVANCES;;6;;;Garcia, Danilo and Kazemitabar, Maryam and Bjork, Elina and Daniele, Thiago Medeiros da Costa and Mihailovic, Marko and Cloninger, Kevin M. and Frota, Mirna Albuquerque and Cloninger, C. Robert;;English;;;Background: About 9 million nurses will be needed by 2030. To face these unprecedented times, governments/institutions focus on educating as many nursing students as possible. This strategy is clouded by burnout and lack of both health and well-being among students and by the fact that personality is one of the major determinants of these health outcomes. Nevertheless, recent findings show that personality is a complex adaptive system (i,e., nonlinear) and that combinations of people's temperament and character traits (i.e., joint personality networks) might provide further information to understand its development, academic burnout, and lack of health and well-being. Aims: Our aims were to investigate the linear relationship between nursing students' personality, burnout, health, and well-being;;;;;;;
rayyan-146535381;Open Peer Commentary and Author Response Regarding `Life Events and Personality Change: A Systematic Review and Meta-Analysis';2024;5;;EUROPEAN JOURNAL OF PERSONALITY;;38;3;569-596;Denissen, Jaap J. A. and Mulder, Joris and Luhmann, Maike and Levelt, Lisa;;English;;;;;10.1177/08902070231211207;;;;;
rayyan-146535382;The relationship between bullying victimization and problematic behaviors: A focus on the intrapersonal emotional competence and interpersonal social competence;2024;6;;CHILD ABUSE \& NEGLECT;;152;;;Jiang, Chaoxin and Shi, Jiaming;;English;;;Background: Evidence consistently demonstrated that bullying victimization was associated with problematic behaviors among adolescents. However, scant attention has been given to simultaneous comparisons of the impacts of two distinct forms of victimization, traditional bullying victimization and cyberbullying victimization. In addition, the mechanisms underlying the relationship between bullying victimization and problem behavior remain inadequately explored. Objective: This study aimed to examine the correlation between bullying victimization and problematic behaviors, as well as the mediating roles of intrapersonal emotional competence and interpersonal social competence. Participants and setting: A sample of 26,450 adolescents with a mean age of 15.44 (SD = 0.56) across nine countries was derived from the Study on Social and Emotional Skills (SSES). Methods: Data analysis was conducted using structural equation modeling, c omprising three key components: the measurement model, the structural model, and the bootstrapping analysis for mediating effects. Results: Both traditional bullying and cyberbullying victimization exhibited positive correlations with problematic behaviors, with cyberbullying victimization demonstrating a stronger effect. The mediating effects of intrapersonal emotional competence and interpersonal social competence were observed in the correlation between bullying victimization and problematic behaviors. Conclusions: This study not only contributed to our comprehension of the underlying mechanisms connecting bullying victimization and adolescent problematic behaviors, but also holds significance for policy development and practice.;;10.1016/j.chiabu.2024.106800;;;;;
