key;title;year;month;day;journal;issn;volume;issue;pages;authors;url;language;publisher;location;abstract;notes;doi;keywords;pubmed_id;pmc_id;PDF files;[]
rayyan-146535398;Method considerations for school psychology from longitudinal research on gifted students;2024;4;;JOURNAL OF SCHOOL PSYCHOLOGY;;103;;;Wai, Jonathan and Kell, Harrison J. and Worrell, Frank C.;;English;;;This article draws from longitudinal research on gifted students to provide method considerations for school psychology research. First, we provide some background of gifted and talented education in the United States. Then, drawing from multiple longitudinal samples of gifted students, in particular the Study of Mathematically Precocious Youth (SMPY), we illustrate the role of replications, including constructive replications. In the middle two sections, we highlight methodological design features focused first on predictors, and then on outcomes, considering types, magnitude, and breadth. Finally, we provide additional considerations and future directions, including expanding the outcome domain, overcoming the limitations of past gifted and talented research studies, and suggesting possibilities for future research. Our article may help improve school psychology research as well as assist school psychology researchers interested in conducting their own longitudinal studies using gifted samples.;;10.1016/j.jsp.2023.101269;;;;;
rayyan-146535399;Students' perceived social-emotional competence: The role of autonomy-support and links with well-being, social-emotional skills, and behaviors;2024;4;;LEARNING AND INSTRUCTION;;90;;;Collie, Rebecca J. and Martin, Andrew J. and Renshaw, Lauren and Caldecott-Davis, Kate;;English;;;Background: The salience of perceived academic competence has been long understood in educational research. Research is now revealing the salience of perceived social-emotional competence (perceived-SEC;;;;;;;
rayyan-146535400;Modeling the hierarchy of teacher personality: The predictive power of domains and incremental facets for teacher job-related outcomes;2024;3;;PERSONALITY AND INDIVIDUAL DIFFERENCES;;219;;;Buric, Irena and Kovacic, Maja Parmac and Jaksic, Kresimir;;English;;;Teacher personality has been recognized as an important factor in predicting job-related outcomes such as burnout, job performance, or motivation. Although personality facets can better predict various outcomes than domains, research on teacher personality at the facet level is still scarce. Thus, the aim of this study was to examine the associations between teacher personality domains and incremental facets and indicators of teachers' job-related outcomes (i.e., job satisfaction, emotional exhaustion, turnover intentions, self-efficacy). Data from 1137 secondary school teachers was collected at two time points. To decompose the variance in personality items into unique domain and facets parts while simultaneously controlling for the response style method factor and the measurement error, the domain-incremental facet-acquiescence bifactor (DIFAB) model was tested. The results showed that incremental facets explained variance in analyzed job-related outcomes beyond the domains, but the amount of the explained variance differed across the criteria.;;10.1016/j.paid.2023.112496;;;;;
rayyan-146535401;A motivational framework of personality development in late adulthood;2024;2;;CURRENT OPINION IN PSYCHOLOGY;;55;;;Bleidorn, Wiebke and Hopwood, Christopher J.;;English;;;Meta-analytic evidence shows that most personality traits tend to increase through early adulthood and middle age but decrease in late adulthood, whereas Emotional Stability continues to increase throughout late adulthood. We propose that these normative patterns of personality development can be explained by motivational theories of aging. Specifically, decreases in Extraversion, Agreeableness, Conscientiousness, and Openness to Experience may reflect a reduced capacity to control one's environment, whereas continued increases in Emotional Stability reflect increases in individual's ability to compensate and cope with age-graded losses. Pairing motivational theories of aging with longitudinal evidence in personality science provides an explanation for empirical patterns of personality trait development and raises interesting possibilities to promote healthy aging.;;10.1016/j.copsyc.2023.101731;;;;;
rayyan-146535402;Extraverts Reap Greater Social Rewards From Passion Because They Express Passion More Frequently and More Diversely;2023;;;PERSONALITY AND SOCIAL PSYCHOLOGY BULLETIN;;;;;Krautter, Kai and Buechner, Anabel and Jachimowicz, Jon M.;;English;;;Passion is stereotypically expressed through animated facial expressions, energetic body movements, varied tone, and pitch-and met with interpersonal benefits. However, these capture only a subset of passion expressions that are more common for extraverts. Indeed, in an initial dyadic study of supervisors and their subordinates (N = 330), extraverts expressed their passion more strongly through these stereotypical expressions of passion, and observers perceived extraverts as more passionate than introverts. Across three studies (Ntotal = 1,373), we subsequently developed a more comprehensive passion expressions and behaviors scale (PEBS). Using this measure in a daily diary study (N = 206, k = 1,862), we found that extraverts not only expressed their passion in more stereotypical ways, but through a broader variety of expressions in general. Extraverts are perceived as more passionate because they have a broader behavioral repertoire, express their passion more frequently and diversely, and thereby attain greater interpersonal rewards.;;10.1177/01461672231211843;;;;;
rayyan-146535403;<i>When Teachers have Autonomy to create SEL Initiatives: Conceptualizations and Iterations</i>;2023;11;;INTERNATIONAL JOURNAL OF EMOTIONAL EDUCATION;;15;2;156-163;Binfet, John-Tyler and Green, Freya L. L. and Roche, Sherri and Scott, Cassidy;;English;;;Teachers may be encouraged to follow a prescribed curriculum when teaching social and emotional learning (SEL), and varied research findings attest to the efficacy of this approach in fostering students' social and emotional competencies. An alternative approach might see teachers create SEL initiatives and infuse, embed, or integrate SEL into core teaching content. This case study explored how, when asked to foster social and emotional learning within their schools, 16 SEL teachers created learning opportunities for students to bolster their social and emotional skills. Teachers were asked to first define SEL and then to create portfolios showcasing three of their SEL lessons or initiatives. Content analysis of definitions revealed that teachers largely defined SEL as fostering students' self-awareness and self -management. Content analysis of each of the teachers' lessons indicated that the learning opportunities or initiatives that teachers introduced were predominantly social in nature and oftentimes focused on having students practice emotion regulation strategies. Findings inform our understanding of the perceptions and actualizations of SEL in applied contexts.;;10.56300/AGDE1576;;;;;
rayyan-146535404;Reciprocal Associations among Social-Emotional Competence, Interpersonal Relationships and Academic Achievements in Primary School;2023;11;;BEHAVIORAL SCIENCES;;13;11;;Yang, Jiaqi and Deng, Yuze and Wang, Yehui;;English;;;The study aimed to examine the reciprocal associations among social-emotional competence (SEC), interpersonal relationships (including teacher-student relationships and peer relationships) and academic achievements in reading, mathematics and science of primary school students. The Chinese versions of the Delaware Social and Emotional Competency Scale, Teacher-student Relationship Scale, Peer-nomination method and Academic Achievement Tests were used to measure students' SEC, teacher-student relationships, peer relationships (including social preference (SP) and social impact (SI)) and academic achievements, respectively. In total, 3995 fourth-grade students participated in the first survey, and 2789 of them were tracked in the follow-up survey two years later. Structural equation modelling was employed to investigate the cross-lagged relationships among the variables across time. The results showed the reciprocal associations between SEC with academic achievements and teacher-student relationships, as well as between academic achievements with SP and teacher-student relationships. Moreover, variations in these reciprocal associations were observed across the subjects of reading, mathematics and science. In summary, this study offers new insights for enhancing students' SEC, interpersonal relationships and academic achievements, and implications for future subject-specific education can be derived by considering the complex interplay in the subjects of reading, mathematics and science.;;10.3390/bs13110922;;;;;
rayyan-146535405;Social and Emotional Skills Predict Postsecondary Enrollment and Retention;2023;10;;JOURNAL OF INTELLIGENCE;;11;10;;Walton, Kate E. and Allen, Jeff and Box, Maxwell J. and Murano, Dana and Burrus, Jeremy;;English;;;Introduction. Social and emotional (SE) skills are known to be linked to important life outcomes, many of which fall into the academic domain. For example, meta-analytic data show that the skill of Sustaining Effort is nearly or just as important for academic performance as intelligence. In a recent study with long-term tracking of high school students, those who came from schools with a strong emphasis on SE skill development were more likely to enroll in college within two years of high school graduation. Longitudinal studies like this one are rare, however. Method. The focus of the present study is on the SE skills of 6662 students assessed during high school and their relationship with high school academic performance, standardized college admissions test performance, and ultimately postsecondary enrollment and retention. Results. We examined mean-level differences in household income, high school GPA, ACT Composite scores, and SE skills by college enrollment and retention status and found several significant differences, often favoring the enrolled or retained group. Moreover, we found support for the incremental validity of SE skills as they predicted enrollment and retention above household income, high school GPA, and ACT scores. Discussion. Understanding SE skills' effects on later academic outcomes is important to help inform early SE skill intervention and development efforts in secondary and postsecondary settings. Additional implications and future directions are discussed.;;10.3390/jintelligence11100186;;;;;
rayyan-146535406;Differences and Similarities in Youth Social-emotional Competence Measurement Between North American and East Asian Countries: Exploratory Graph Analysis using the OECD Survey on Social and Emotional Skills Data;2024;2;;CHILD INDICATORS RESEARCH;;17;1;57-79;Lee, Juyeon and Junus, Alvin;;English;;;Social-emotional competence (SEC) is a multidimensional construct involving diverse skills and mindsets contributing to intrapersonal and interpersonal well-being. Despite increasing efforts to promote youth SEC worldwide, the existing SEC measurements are largely based on frameworks and evidence originating from Western societies, questioning the applicability of prevalent SEC measurement models to non-Western contexts. This study aims to compare a measurement model of SEC between East Asian (EA) and North American (NA) countries. This study analyzed youth self-reports from the 2018 OECD Survey on Social and Emotional Skills (SSES;;;;;;;
rayyan-146535408;Revisiting predictor-criterion construct congruence: Implications for designing personnel selection systems;2023;9;;INDUSTRIAL AND ORGANIZATIONAL PSYCHOLOGY-PERSPECTIVES ON SCIENCE AND PRACTICE;;16;3;307-312;Hough, Leaetta M. and Oswald, Frederick L.;;English;;;;;10.1017/iop.2023.35;;;;;
rayyan-146535409;How Personality Matters for Education Research;2023;9;;EDUCATIONAL PSYCHOLOGY REVIEW;;35;3;;Jach, Hayley K. and Bardach, Lisa and Murayama, Kou;;English;;;The field of personality psychology could contribute to the aims of educational research, but several misconceptions may hold back this synthesis. We address three ``misconceptions{''} about personality psychology that are surprisingly pervasive outside of that field: that there are personality types, that personality is fixed, and that the existence of personality implies that situations are unimportant. We then cover four ways that personality psychology can assist educational aims: personality can be used to (1) boost our ability to accurately predict educational outcomes, (2) inform educational interventions, (3) support the academic development of all learners in personalised learning interventions, and (4) be employed as target outcomes for education. In the process, we show how personality relates to important educational outcomes, outline theoretical links with educationally relevant concepts like socio-emotional skills, and include an overview of current personality scales that can be used when getting started. Through this paper, we hope to stimulate and enthuse researchers to advance synthesis between the disciplines.;;10.1007/s10648-023-09807-4;;;;;
rayyan-146535410;Teacher personality domains and facets: Their unique associations with student-ratings of teaching quality and teacher enthusiasm;2023;12;;LEARNING AND INSTRUCTION;;88;;;Buric, Irena and Butkovic, Ana and Kim, Lisa E.;;English;;;Background: Previous research on the relationship between teacher personality and teaching performance yielded mixed results and typically considered only the broad personality domains while neglecting the narrower personality facets that constitute the domains.Aim: The aim of this study was to examine the incremental value of teacher Big Five personality facets in explaining student-ratings of teaching quality and teacher enthusiasm.Samples: In total, 1067 teachers and 18,814 of their students from 73 secondary schools in Croatia participated in the study. Method: Teachers self-reported their personality whereas students rated the teaching quality and displayed enthusiasm of their teachers. Each teacher was rated by one class of students.Results: The bifactor-(S-1) multilevel structural equation models for each Big Five personality domain showed that both the general reference factor and the specific factors explained the variance in student-ratings of teaching quality and teacher enthusiasm.Conclusions: A more fine-grained approach to examining the effects of teacher personality at different levels of hierarchy might be helpful for identifying specific parts of teacher personality with the greatest explanatory power in predicting teaching performance.;;10.1016/j.learninstruc.2023.101827;;;;;
rayyan-146535411;Do Temperament Trajectories From Late Childhood Through Adolescence Predict Success in School? Findings From a Longitudinal Study of Mexican-Origin Youth;2024;1;;JOURNAL OF PERSONALITY AND SOCIAL PSYCHOLOGY;;126;1;128-149;Cheng, Rongxin and Lawson, Katherine M. and Robins, Richard W.;;English;;;School achievement has long-term consequences for occupational success, mental health, and overall psychological adjustment. The present study examined the association between temperament trajectories from late childhood through adolescence and academic outcomes during late adolescence and young adulthood. Data come from the California Families Project, a longitudinal study of 674 Mexican-origin youth assessed 12 times from Age 10 to 23, and from school records. Results from latent growth curve models indicate that higher levels of Effortful Control (EC) at Age 10 were associated with better academic achievement (i.e., higher high school grade point average and test scores, greater likelihood of high school graduation and college attendance) in late adolescence and young adulthood. Higher levels of Negative Emotionality (NEM) at Age 10 were associated with worse academic achievement, but this effect did not hold for all facets of NEM. Neither the levels nor slopes of Positive Emotionality (Surgency, Affiliation) consistently predicted school achievement. There were no main effects of the EC or NEM slopes;;;;;;;
rayyan-146535412;Impact of patterns of language use and socio-economic status on a constructed response Situational Judgment Test (SJT);2023;8;;PLOS ONE;;18;8;;Pan, Xuan and Huang, Vivian and Laumbach, Sonia and Copeland, H. Liesel and Akinola, Modupeola and Rosenbaum, Daryl and MacIntosh, Alexander;;English;;;The study explored the impacts of patterns of language use (PLU) and socio-economic status (SES) on Casper, a constructed-response situational judgment test (SJT). 10,266 applicants from two U.S. medical schools were grouped into self-reported balanced bilinguals, unbalanced bilinguals, English monolinguals, and English as a Second Language (ESL) students. A multicomponent SES composite was used to assess the degree of socioeconomic disadvantage (DSD). Results from a hierarchical regression analysis showed that after accounting for demographic variables, both PLU and DED were significant factors on applicants' Casper performance. Bilingualism was associated with better Casper performance compared to English monolinguals and ESL students. No significant effect of speaking English as a native language was found on applicants' Casper performance. English monolinguals and ESL students performed equivalently on Casper. Finally, high DSD was associated with better Casper performance than low DSD, and the impact of DSD on Casper held the same across all four language groups. These findings provide evidence that socio-cultural factors, such as PLU and DSD have important impacts on SJT performance. Further research is needed to understand the role of differences in language construction across socio-cultural factors on constructed-response SJT performance.;;10.1371/journal.pone.0289420;;;;;
rayyan-146535413;The impacts of Abecedarian and Head Start on educational attainment: Reasoning about unobserved mechanisms from temporal patterns of indirect effects;2023;;;EARLY CHILDHOOD RESEARCH QUARTERLY;;65;;261-274;Pages, Remy and Bailey, Drew H. and Duncan, Greg J.;;English;;;Mechanisms translating initial impacts of early childhood education (ECE) programs into longer-term effects are poorly understood. This article posits that the temporality of unobserved mediated effects are integral to our understanding of the pathways underlying ECE programs' long-term impacts. Leveraging panel data, we examined the patterns of indirect effects from two ECE programs on educational attainment via bundled mediators measured at age 8 or 10, 12, and 15 (the Abecedarian Project: N =107;;;;;;;
rayyan-146535414;Social, Emotional, and Behavioral Skills: Age and Gender Differences at 12 to 19 Years Old;2023;6;;JOURNAL OF INTELLIGENCE;;11;6;;Feraco, Tommaso and Meneghetti, Chiara;;English;;;Individuals use social, emotional, and behavioral (SEB) skills to build and maintain social relationships, regulate emotions, and manage goal-directed behaviors. A promising integrative framework of SEB skills was recently proposed, showing that they matter for positive outcomes during adolescence. Nothing is known about how and whether they differ between 12 and 19 years old and whether such differences depend on gender (males or females). Uncovering their age trajectories is fundamental because SEB skills are highly needed during this period of life. Educators, psychologists, and policymakers need to understand when, why, and how interventions concerning SEB skills should be proposed, potentially considering male and female profiles. To cover this gap, we cross-sectionally analyzed data from 4106 participants (2215 females, 12-19 years old). We highlighted age and gender differences in the five domains of SEB skills (self-management, innovation, cooperation, social engagement, and emotional resilience). Our results show that each SEB skill follows a specific age trend: emotional resilience and cooperation skills increase naturally between 12 and 19 years old, while innovation, social engagement, and self-management skills decline, especially between 12 and 16 years old, and grow later. The trajectories of self-management, social engagement, and emotional resilience skills also differ between males and females. Importantly, we detected declines in SEB skills (especially for social engagement and innovation skills) that can inform policies and interventions to sustain SEB skills in youths to favor their well-being and success in this crucial period.;;10.3390/jintelligence11060118;;;;;
rayyan-146535415;Reconciling Hard Skills and Soft Skills in a Common Framework: The Generic Skills Component Approach;2023;6;;JOURNAL OF INTELLIGENCE;;11;6;;Lamri, Jeremy and Lubart, Todd;;English;;;The distinction between hard and soft skills has long been a topic of debate in the field of psychology, with hard skills referring to technical or practical abilities, and soft skills relating to interpersonal capabilities. This paper explores the generic composition of any skill, proposing a unified framework that consists of five distinct components: knowledge, active cognition, conation, affection, and sensory-motor abilities. Building upon previous research and theories, such as Hilgard's ``Trilogy of Mind{''}, the generic skill components approach aims to provide a comprehensive understanding of the structure and composition of any skill, whether hard or soft. By examining these components and their interactions, we can gain a more in-depth understanding of the nature of skills and their development. This approach has several potential applications and implications for various fields, including education, training, and workplace productivity. Further research is needed to refine and expand upon the generic skill components theory, exploring the interactions between the different components, as well as the impact of contextual factors on skill development and use.;;10.3390/jintelligence11060107;;;;;
rayyan-146535417;What I Do and What I Can Do: Testing the convergence and incremental validity of social, emotional, and behavioral skills vs. traits for predicting academic success;2023;6;;JOURNAL OF RESEARCH IN PERSONALITY;;104;;;Soto, Christopher J. and Napolitano, Christopher M. and Sewell, Madison N. and Yoon, Hee Jun and Murano, Dana and Casillas, Alex and Roberts, Brent W.;;English;;;The present research examined relations between social, emotional, and behavioral (SEB) skills, personality traits, and academic success in a sample of adolescents (N = 975). Results indicated that both skills and traits robustly predicted school grades, educational aspirations, and performance on a standardized achievement test, even after accounting for demographic characteristics. Moreover, skills and traits were often interchangeable: when assessed using the same cognitive, affective, and behavioral referents, they converged strongly and did not provide incremental validity over each other for predicting most outcomes. However, skills provided some in-cremental validity beyond traits for predicting standardized test performance. Taken together, these findings highlight the importance of SEB skills and personality traits for predicting and understanding academic success.;;10.1016/j.jrp.2023.104382;;;;;
rayyan-146535418;Life events sometimes alter the trajectory of personality development: Effect sizes for 25 life events estimated using a large, frequently assessed sample;2024;2;;JOURNAL OF PERSONALITY;;92;1;130-146;Dugan, Keely A. and Vogt, Randi L. and Zheng, Anqing and Gillath, Omri and Deboeck, Pascal R. and Fraley, R. Chris and Briley, D. A.;;English;;;Objective: Personality changes across the life span. Life events, such as marriage, becoming a parent, and retirement, have been proposed as facilitating personality growth via the adoption of novel social roles. However, empirical evidence linking life events with personality development is sparse. Most studies have relied on few assessments separated by long time intervals and have focused on a single life event. In contrast, the content of life is composed of small, recurrent experiences (e.g., getting sick or practicing a hobby), with relatively few major events (e.g., childbirth). Small, frequently experienced life events may play an important and overlooked role in personality development.Method: The present study examined the extent to which 25 major and minor life events alter the trajectory of personality development in a large, frequently assessed sample (N-sample = 4904, N-assessments = 47,814, median retest interval = 35 days).Results: Using a flexible analytic strategy to accommodate the repeated occurrence of life events, we found that the trajectory of personality development shifted in response to a single occurrence of some major life events (e.g., divorce), and recurrent, ``minor{''} life experiences (e.g., one's partner doing something special).Conclusion: Both stark role changes and frequently reinforced minor experiences can lead to personality change.;;10.1111/jopy.12837;;;;;
